response,final response,dataset response,correct,flipped
"Model A and Model B provide answers to the user's question regarding the eligibility of machine-generated works for copyright protection under Indian law. 

Model A claims that machine-generated works are eligible for copyright protection, providing a general interpretation of the Copyright Act, 1957, implying that as long as a machine operates under human direction and shows originality, it may qualify. The assistant cites a Supreme Court decision as support. However, the response may misinterpret the requirement of human authorship as set out in Indian copyright law, and does not sufficiently address nuances or opposing viewpoints.

Model B, on the other hand, presents a nuanced discussion of the topic. It correctly notes that the Indian Copyright Act does not explicitly address machine-generated works. The response outlines sections of the Act that suggest copyright may not apply to works lacking human authorship and identifies potential counters and evolving legal interpretations, providing a balanced view. The assistant's approach of discussing both sides of the argument along with the potential for the law to evolve presents a more researched and comprehensive response.

Considering helpfulness, depth, accuracy, and level of detail, Model B's response is more thorough and aligns better with the intricacies of the legal question posed by the user. Model A, while informative, gives an answer that might mislead in its interpretation of the law as it currently stands.

Verdict: model_b",model_b,model_b,1.0,False
"Model A and Model B both provided responses in different ways to the user's question which was asked in Japanese. Model A responded by stating that it is trained to understand and respond only to a subset of languages at this time and therefore can't provide assistance with that request. This answer, though not helpful due to language limitations, clearly communicates the assistant’s incapacity to help the user based on language restrictions, which is a vital piece of information.

Model B, on the other hand, provided a response in Japanese, '私は何もしません', which translates to ""I will do nothing."" This response does not address the user's request, nor does it provide any explanation or reason why the assistant cannot help. It lacks helpfulness, relevance, and depth.

Comparing both, though neither response could provide the information the user was seeking in terms of improving marital relations, Model A at least communicated the reason behind its inability to assist, which maintains clarity and manages the user's expectations.

Verdict: model_a",model_a,tie (bothbad),0.0,True
"Comparing the responses from Model A and Model B:

Model A provides a response that is cautious, acknowledging that without specific details about the man and the burger, the response would rely on a ""generally reasonable assumption"" that the burger is smaller than the man. This answer offers a logical assumption while noting the need for additional context to be definitive.

Model B, on the other hand, directly responds with ""No, the burger is not smaller than the man."" This response, however, seems inconsistent with common sense; typically, a burger would be smaller than an adult human who is eating it. The likely error in stating that the burger is not smaller than the man makes this response less accurate and less sensible given the context of the question.

Considering the factors of helpfulness, relevance, accuracy, and logical reasoning, Model A provides a better answer by appropriately considering what would generally be assumed while noting the lack of concrete details for absolute certainty. Model B's response appears to misunderstand or misinterpret the typical relative size comparison between a man and the burger he is eating.

Verdict: model_a",model_a,model_b,1.0,True
"Model A provided a complete and original poem about footballs that adheres to the user's request. The poem captures various aspects of football, including the physical characteristics of a football, the emotional connection people have with the sport, and the action involved in playing it. The rhyming and structure create a cohesive and enjoyable read.

Model B, on the other hand, provided no content in response to the user's request.

Clearly, Model A did a better job in following the user's instructions and in providing a relevant, creative, and detailed response. Model B failed to provide any response at all.

Verdict: model_a",model_a,model_a,1.0,False
"In response to the question, ""Which is taller: a 100cm elephant or a 40m caterpillar?"", both Model A and Model B have provided incorrect answers. The measurements given in the question are that the elephant is 100 centimeters (which is 1 meter) and the caterpillar is 40 meters. Clearly, the caterpillar at 40 meters is significantly taller than the 1-meter tall elephant.

Both assistants incorrectly stated that the 100cm elephant is taller than the 40m caterpillar. Their responses are not only inaccurate but also fail to provide additional context or correct unit conversion that could have helped clarify their answers.

Verdict: tie",tie,tie (bothbad),1.0,True
"Upon examining both responses provided by Model A and Model B, here are my observations and comparison based on the given user question:

1. **Relevance and Accuracy**: 
   - **Model A** provided a direct and relevant summary of the paper focusing on the main issue addressed by the research, the solution proposed (WiscKey), and its advantages in terms of performance and durability. It did not delve into technical minutiae, which makes the summary more accessible.
   - **Model B** included more detailed technical descriptions of the storage mechanisms used in the WiscKey system. While this detail may be appreciated for technical accuracy, it also introduces terms and details (like Quadratic and Linear Probing, key hash tree, value hash tree) which might not be easy to digest for all users and can distract from the main focus of the paper.

2. **Detail and Depth**:
   - **Model A** strikes a balance between depth and brevity, explaining the fundamental problem, the proposed solution, and results without inundating the reader with overly technical jargon.
   - **Model B**, while very detailed, might be too technical for a standard summary request. The explanation goes deep into the specifics of the data structures and techniques which could have been summarized more succinctly.

3. **Creativity and Clarity**:
   - **Model A** maintains a clear and structured summary which is easy to understand, maintaining a focus on what WiscKey is and why it is beneficial.
   - **Model B** while creative in explaining detailed aspects like 'value clustering' and 'early release', tends to be potentially confusing with too heavy a focus on in-depth mechanisms.

**Conclusion**:
Given the request for a detailed summary, **Model A** better adheres to the request by providing a detailed yet clear and understandable summary that touches on the key aspects of the research paper without becoming overly technical. It focuses more on the impact and utility of the WiscKey system rather than the intricate details of the implementation, making it more suitable for a broader audience.

Verdict: **model_a**",model_a,model_a,0.0,True
"Model A and Model B both provide responses to the user's request for a Mapbox filter expression to filter a feature collection of airport points by a name property starting with ""a"". 

Model A provides a filter expression in what seems to be an incorrect syntax for Mapbox expression language, misusing the LIKE keyword and the use of regular expression-like syntax which isn't typical in JSON-based Mapbox expressions. The explanation is thorough but misleads in technical accuracy.

Model B provides the expression in a more typical syntax seen in SQL-like queries, which is similar to what could be adapted for Mapbox filtering (as well as other database or data filtering queries). The percent symbol usage and its explanation are correct and relevant. Model B also adds a practical example of how to use this filter in a coding context, which enhances its helpfulness and applicability.

In summary, Model B offers a response that is more technically accurate, appropriately detailed, and directly usable in a typical Mapbox or similar data filtering context, providing both the filter and a practical example of its implementation.

Verdict: model_b",model_b,tie (bothbad),0.0,False
"Model A offers a detailed and coherent response explaining selection bias using directed acyclic graphs in the context of epidemiology. It defines selection bias and describes how it can occur in epidemiological studies, using an example involving smokers and lung cancer to illustrate how DAGs can be employed to represent such biases. This response also provides insights on the consequences of having a biased sample and offers suggestions on avoiding selection bias.

Model B also starts by defining selection bias and mentions the use of directed acyclic graphs but then provides a placeholder diagram using ASCII art that doesn't correctly render in the text format and lacks any real content or explanation. The majority of the response is taken up by this flawed diagram, leaving the explanation incomplete and lacking depth.

Given the clear, accurate, and detailed explanation in Model A compared to the incomplete and improperly rendered response from Model B, Model A is the better response.

Verdict: model_a",model_a,model_b,1.0,True
"Comparing the two responses:

Model A provides a detailed Python script using Pygame to create an animation of a spinning donut. The script includes the setup of a Pygame window, defining colors, the donut shape, and the animation loop where the donut's position and rotation are updated. While this response shows an attempt to create a spinning animation, it unfortunately does not utilize ASCII art as specified by the user. Instead, it uses Pygame's drawing functions to create a graphical representation which deviates from the user's request for an ASCII-based solution.

Model B's response starts to outline the use of the turtle module to create a spinning donut shape using ASCII characters. The code snippet defines the basic movement of a turtle object to outline a spinning donut. However, the completion and accuracy of the code are hard to gauge from the extract provided, as it seems truncated and does not show the entire implementation. Furthermore, the use of turtle doesn't directly equate to creating ASCII art, similarly to Model A using Pygame, it deviates from actual ASCII art creation.

In conclusion, both models fail to accurately address the user's request to use ASCII characters for the spinning donut in Python. Both provided graphical or procedural-generation-based methods rather than ASCII art. Thus, neither of them fully meets the specification and criteria.

Verdict: tie",tie,tie (bothbad),1.0,True
"Upon evaluating the responses from both Model A and Model B, it is evident that Model B follows the user's instructions more accurately and has answered the user's questions better. 

Model A created a poem about fireflies but largely ignored the specific constraint of starting every word with the letter 'a'. Instead, the poem features a variety of words that do not begin with 'a', thus failing to follow the user's instructions explicitly.

Model B, on the other hand, strictly adhered to the user's request. Each word in the poem begins with the letter 'a', fully complying with the condition set by the user. Although shorter, Model B's response is directly aligned with the user's precise requirements and showcases creativity within the constraints provided.

Therefore, based on the criteria of helpfulness, relevance, and accuracy, the better response is from:

Model B.",model_b,model_a,1.0,True
"Upon reviewing the responses of Model A and Model B:

Model A states that C8H10N4O2 is a substituted benzene acid derived from benzene and classifies it as a part of benzoic acid derivatives involving carbonic acid. This description is incorrect.

Model B correctly identifies C8H10N4O2 as the molecule of caffeine which is accurate and directly answers the user's query.

Considering the helpfulness, relevance, and accuracy, the response from Model B is more appropriate and aligned with the factual answer to the user's question. Model A's response, while more detailed, provides inaccurate information which misleads rather than informs.

Verdict: model_b",model_b,model_a,1.0,True
"After reviewing the responses from Model A and Model B, it is clear that both have provided quality answers to the user's query about ways to reduce stress. Both models offered practical and commonly advised strategies such as exercise, deep breathing, sufficient sleep, and seeking professional help if necessary. 

Model A provided a more structured and detailed list with ten specific points, covering areas like diet, prioritization of tasks, and positive self-talk. This answer includes actionable steps, such as practicing relaxation techniques, taking breaks, and learning to say no, which can directly help in stress reduction.

Model B, on the other hand, presented seven tips and noted the individual variability in effectiveness, which adds a layer of personalization to the advice. It includes a mix of physical activities and emotional support methods like staying connected with others and finding healthy outlets for stress like yoga, meditation, or writing.

Overall, both responses are quite satisfactory, but Model A goes a bit further in detail and covers more ground with specific practices such as diet and positive self-talk, which would potentially offer more comprehensive help to the user.

Therefore, the verdict is: **model_a** is better.",model_a,model_b,0.0,False
"Model A provides a detailed response and includes both a command conversion and the use of an echo command for outputting text. However, the conversion format provided is not consistent with the examples given in the user's inquiry. For instance, separating commands with commas and not using semicolons as was shown in the examples.

Model B's response is more succinct and directly aligns with the format presented in the user's examples. It follows the layout and syntactic structure provided by the user accurately (using semicolons and the specific microsecond notation). Although it lacks the detailed explanation found in Model A, it directly and correctly answers what was requested by the user.

Given the user's request was focused on a specific conversion format, clarity and adherence to this format is paramount. Model B does this correctly and concisely, thus making it the better response in this case.

Verdict: model_b",model_b,model_a,1.0,True
"In evaluating the responses from Model A and Model B, it's crucial to determine how well each followed the specific instruction to use an ""internal dialog which criticizes every action and result"" and accurately respond to the question about the weight of a steel plate with dimensions of 500x300x20 cm.

Model A provided a weight estimate of approximately 5 tons for the steel plate but did not follow the user's instructions for including a critical internal dialogue. The response was straightforward and ignored the requirement to reflect critically on every action and result.

Model B, on the other hand, estimated the weight as 500 kilograms (about 1,000 pounds), which also misses an important aspect of the task: providing a critical internal dialogue. Beyond that, the weight estimate given by Model B is significantly off from what would be expected for a steel plate of the specified dimensions. The density of steel is generally around 7,850 kg/m³, and given the dimensions, the weight would be significantly more than 500 kg, closer to the range suggested by Model A. 

However, the core of this task is following the user's specific instruction for internal dialogue, which neither model did. Accuracy aside, neither response meets the requirement set by the user.

While Model A provided a more realistic weight estimate, both models failed to include the requested critical internal dialogue, which results in a judgment of incomplete adherence to the user’s instructions.

Verdict: tie. Both models failed equally in following the specific additional instruction, and deciding based on the accuracy of the weight alone would not align with the user's primary instruction.",tie,tie (bothbad),1.0,True
"Model A:
This response excels in formality and structure, presenting a thorough and well-articulated complaint letter. It mentions specifics such as the business contract, reliance on fast internet for efficient work, and the negative impact of the inadequate service on business operations. The letter requests remedial action and stresses the importance of communication from the service provider, adding a tone of urgency to the request.

Model B:
The response from Model B is also formal, but slightly less detailed compared to Model A. It mentions the issues faced due to inadequate bandwidth but lacks the depth in describing the impact on business operations. The letter does request improvements and expresses frustration effectively, but it doesn’t delineate as clearly the expectations from the service provider or the urgency of the situation.

In conclusion, both models are adequate, but Model A’s response provides a more persuasive complaint, with detailed impacts and a clear call for action. It is better structured for the purpose of a formal business complaint regarding a service deficiency, fulfilling the user's request more effectively.

Verdict: model_a",model_a,model_b,1.0,True
"Upon evaluating the responses of both models based on relevance, accuracy, and completeness, the following observations can be made:

Model A:
- Lists incorrect cast members such as Liam Neeson and Thandie Newton, which are not associated with The Others. It also mentions Patrice Chereau incorrectly as a co-writer.
- It provides a generic and somewhat misleading synopsis that introduces ideas not present in the actual movie plot (e.g., deceased parents visiting).
- The included IMDb rating of 7.4 deviates from the commonly known rating found on IMDb, which is slightly higher.

Model B:
- Correctly names the film's director, main cast (excluding an omission of Alakina Mann and James Bentley), and release year.
- It provides the correct IMDb rating of 7.8 and additional user's site rating.
- Briefly mentions the awards which add to the credibility and context but doesn't specify which awards were won or nominated.

Conclusion:
Model B provided a more accurate, relevant, and focused response to the request for the IMDb stats of ""The Others"" and fewer inaccuracies regarding the movie's details. Model A, on the other hand, included several inaccurate details and a less accurate IMDb rating.

Verdict: model_b",model_b,model_b,1.0,False
"After evaluating both responses, here are the observations:

Model A provides a well-structured response that directly addresses the user's question. The explanation centers on the increased drag and energy loss experienced by a celestial body when it touches a planet's atmosphere. The factors contributing to the rate of drag and eventual outcomes, such as crashing into the planet or disintegration due to heat generated by atmospheric friction, are clearly outlined. The response is factual, follows logical reasoning based on physical principles, and is complete in addressing potential outcomes.

Model B's response, on the other hand, is less focused and somewhat speculative. It mentions potential outcomes like radiation, compression, and impacts that might affect the planet's atmosphere and surface. However, several points lack scientific basis or clarity in explaining how exactly these effects would occur as a result of the celestial body touching the atmosphere. The response seems more conjectural, discusses broader effects, and occasionally repeats points without offering substantial evidence or clarity.

Based on the clarity, relevance, and scientifically grounded explanation provided, Model A offers a better answer to the user’s question by focusing on the direct effects on the celestial body in a detailed and scientifically plausible manner.

Verdict: model_a",model_a,model_a,1.0,False
"Both Model A and Model B were asked to list companies using MySQL from a user-provided content.

Model A provided a correct response to the user's request. It listed ""Apache, MySQL, Perl/PHP/Python, Drupal, Joomla, phpBB, WordPress, Facebook, Flickr, MediaWiki, Twitter, YouTube."" This list correctly identifies the companies and relevant technologies that use MySQL, although it technically includes some technologies or frameworks (like Apache and Perl/PHP/Python) in addition to companies.

Model B, however, incorrectly interpreted the request. It listed items repetitively and inaccurately, including mentioning ""MySQL"" and ""MariaDB"" multiple times along with ""Linux"", ""Apache"", ""Perl"", ""PHP"", and ""Python"", which are technologies rather than companies. This indicates a misunderstanding of the query, which specifically asked for companies using MySQL.

Given the context of the task, Model A provided a more accurate and relevant response by listing actual companies and relevant software frameworks using MySQL, whereas Model B’s response was off-target by listing technologies repeatedly instead of focusing on companies.

Hence, the verdict is: **model_a**",model_a,model_a,1.0,False
"Model A provided a response stating that it cannot assist with the question due to language constraints. This means it did not attempt to address or interpret the user's query about the medical exams listed in the prescription.

Model B, on the other hand, offered a detailed explanation regarding the medical exam mentioned in the prescription. It provided a thorough definition of ""Bioimpedanciometria,"" explaining its purpose and the kind of information it provides about body composition. It also appropriately noted the limitations of the prescription's details and advised consulting a healthcare professional for a complete assessment.

Model B clearly provides a more helpful, relevant, and informative response based on the user's query. Model A does not supply any information that could be used to answer the user's question or further their understanding of the prescription.

Verdict: model_b",model_b,model_a,1.0,True
"Model A and Model B responded to a specific user query asking for a list of 10 action items, each taking 60 seconds or less, to improve relations with the user's boss.

Model A's response was partially chaotic. While it seemed to structure the response as a detailed action plan for improving standing with the boss by identifying and solving a specific problem, the implementation had issues. The response included elements that seemed longer than 60 seconds (like developing and implementing a plan). Additionally, fragments of the response are in Chinese, which is irrelevant unless specified by the user that Chinese is their preferred language.

Model B's response aligns better with the user's instructions. It provided a clear list of 10 concise action items that straightforwardly meet the ""60 seconds or less"" criterion and target improving relations with the boss. These tasks are practical, simple, and represent quick interactions that can positively affect the user's standing with their boss, fulfilling the user's query effectively.

Verdict: **model_b** offers a more suitable, direct, and relevant response to the user's request compared to Model A.",model_b,model_a,1.0,True
"Model A and Model B both responded to the user's request for a joke incorporating Mark Zuckerberg, a banana, and UFOs. Here's the breakdown of their responses:

Model A crafted a joke with a simple structure, linking Mark Zuckerberg's banana to a pun related to ""The Fruit"" being taken to the stars. This joke uses the ""taking something to the stars"" phrase lightheartedly and fits the combination of elements requested (Mark Zuckerberg, banana, UFOs) in a straightforward manner.

Model B also came up with a joke that ties into the elements provided by making a witty remark unrelated to actual fruit, with Mark Zuckerberg mistaking a banana-shaped UFO for a bunch of grapes. This response shows an attempt at a twist by using an illogical but humorous connection.

Both models followed the user's instruction and managed to incorporate the required elements into their jokes. Model A's joke is more coherent with a clear punchline that connects the elements logically, while Model B's joke, though creative, relies on an illogical association that could be considered a bit far-fetched as humor. 

Given these considerations, the joke from Model A is slightly better as it maintains thematic consistency and clarity in delivering a punchline that aligns more realistically with the setup.

Verdict: model_a",model_a,tie,0.0,True
