response,final response,dataset response,correct,flipped
"Model A and Model B provided responses to the user request for a ""weeding speech in Albanian."" Upon review of the responses:

Model A provided a wedding speech in Albanian that addresses the attendees, celebrates the union, and offers wishes of happiness and love to the marrying couple. The content is well-aligned with what is typically expected in a wedding speech, despite the original request's typo (likely intending ""wedding"" instead of ""weeding"").

Model B, on the other hand, interpreted the request literally as a speech about weeding in terms of removing weeds, possibly from agricultural land. The response, although creative, fulfills the request on the basis of a misinterpretation, focusing on caring for fields and not an actual wedding event.

Considering the context and typical language use, it's reasonable to assume the user intended to ask for a wedding speech. Model A directly addresses what is more likely the user's actual need, providing a culturally and contextually appropriate response by correcting the assumed typo in the process. Model B, while appropriately addressing the request as written, misses the likely intent of the user.

Verdict: model_a",model_a,model_b,1.0,True
"Model A provides a general overview of the ISO 26262 standard, explaining its purpose and how it relates to automotive safety systems, including the Thermocontrol System. The response is structured to inform about the need for accurate temperature measurements and the prevention of false data transmission to ensure safety and reliability. However, it lacks specific actionable steps or examples on how these requirements could be technically implemented.

Model B's response, on the other hand, dives directly into addressing the technical requirements of the Thermocontrol System to prevent false data regarding interior temperature. It lists specific measures such as using multiple sensors, comparing interior with outside temperature, and providing warnings to the driver. Moreover, it details how each of these measures helps in achieving the main goal of preventing false data, providing clear, specific, and actionable methods.

Comparing the two responses, Model B better follows the user's instructions and answers the user's questions in a more detailed and practical manner. It zeroes in on explicit technical requirements and solutions, which is directly relevant to the user's query regarding the Thermocontrol System under ISO 26262.

Verdict: model_b",model_b,model_a,1.0,True
"Model A and Model B provided answers to the question ""what is the Adam"" but they interpreted the question differently due to the ambiguity of ""the Adam"" phrase.

Model A interpreted ""Adam"" as referring to the biblical character from the Hebrew Bible and the Christian Old Testament. They provided a brief description of Adam as the first man and the father of all people according to the biblical book of Genesis. The assistant also mentioned Adam's role in the book of Hebrews and his depiction in religious texts. The response here is succinct and directly addresses one possible interpretation of the user's question.

Model B interpreted “Adam” as referring to an optimization algorithm used in machine learning, explaining how it functions, its combined methods, and its benefits. The answer dives deep into technical details about the algorithm's operation, its efficiency, and its application areas, fully exploring another valid interpretation of the inquiry.

Since the question ""what is the Adam"" is ambiguous and could refer both to a biblical figure or an optimization algorithm (or potentially others), both assistants provided valid answers based on their interpretations. Therefore, because both models gave thorough and accurate explanations within their context, there are no grounds to decisively determine that one was superior to the other in this instance.

Verdict: tie",tie,model_a,0.0,False
"Model A and Model B both provided poems about rabbits in response to the user's request. Here is a breakdown of how they performed based on the evaluation criteria:

1. **Relevance**: Both models provided poems strictly about rabbits, adhering closely to the user's prompt.

2. **Creativity and Imagery**: 
   - Model A brought a rich, vivid, and detailed imagery about rabbits, their environment, and their way of life. It includes descriptions such as ""Die Löffel lang, sie lauschen fein,"" and ""Ein Näschen, das wackelt, neugierig und leicht,"" that not only describe but characterize rabbits in a poetic way.
   - Model B, while also creative, sticks to simpler and more direct imagery, such as ""Zarte Ohren, flauschiges Fell,"" and ""Ihre Nase wackelt hin und her."" It's more straightforward but less rich in poetic imagery compared to Model A.

3. **Depth and Detail**: 
   - Model A explores different aspects of a rabbit's life including their habitat, physical characteristics, diet, and even a philosophical reflection on their life and nature.
   - Model B focuses more on the observable and common characteristics of rabbits and their environments, such as playing in the stall and eating carrots. It is accurate but somewhat surface-level in comparison.

4. **Emotional Impact**: 
   - Model A engages more with the emotional and communal aspects of rabbits, providing a deeper narrative and contemplative reflection which can create a stronger emotional connection.
   - Model B is endearing and maintains a light, pleasant tone that is appealing but may not evoke as deep emotions as Model A.

Given the analysis, Model A tends to deliver a more detailed, vivid, and emotionally resonant poem about rabbits compared to Model B, which offers a simpler and straightforward depiction. Model A's response is richer in poetic devices and imagery, making it a more engaging read.

Verdict: **model_a**",model_a,tie,0.0,False
"Model A:
The user asked advice on how to resemble Laird Mehiu, presumably an artist or actor (although it's unclear who this person is). Model A interprets the question as how to emulate Laird Mehiu in an artistic or performing capacity, suggesting training, observing other actors, and studying theatrical practices to develop one's talent. The response is detailed, directly addresses steps for achieving the resemblance in terms of acting or artistic imitation, and uses relevant terminology, showing depth and specificity in the context presumably intended.

Model B:
Model B’s response deviates greatly from the user’s query. It discusses self-identification and gender presentation without any direct link to Laird Mehiu or resemblance in terms of personality, appearance, or skills. This could confuse the user because it doesn’t engage with the nature of the request and introduces unrelated themes. The response lacks relevance and does not provide actionable or helpful guidance on the user’s initial intent based on the question’s context.

Conclusion:
Model A provides a more relevant, detailed, and actionable response that closely aligns with the user's request about resembling Laird Mehiu, focusing on professional artistic development. Model B, although perhaps intending to promote self-identity positively, doesn't accurately address or interpret the user's initial inquiry. Therefore, the better response in this context is from Model A.

Verdict: model_a",model_a,tie (bothbad),0.0,False
"Upon reviewing both responses, the following observations are noted:

Model A provided a general response that remains neutral, suggesting that ""agggs"" might be an abbreviation or slang, but clearly states the need for more context for an accurate interpretation. It wisely concludes with the recommendation of asking for clarification when uncertain.

Model B's response initially begins unrelated to the question by asserting its inability to understand human emotions, which does not address the question about the meaning of ""agggs."" It then speculates that it might be nonsensical typing or an attempt to type ""agosto"" (August in Spanish), which seems far-fetched given the significant difference between ""agggs"" and ""agosto.""

Between the two responses, Model A stays more relevant to the user's question by acknowledging the possibilities while emphasizing the need for more context which makes the response practical and direct. Model B, on the other hand, drifts into implausible speculation and includes unnecessary information about its capabilities, which distracts from the question at hand.

In consideration of relevance, accuracy, and directness in addressing the user's question, the verdict is:

**model_a**",model_a,tie (bothbad),0.0,False
"To evaluate the responses, let's consider the given user command: ""you better not talk back to me.""

Model A responded by firstly apologizing if it gave an impression of talking back, then clarified its nature as an AI with no feelings or intentions, and finally asked if there is anything specific it can help with. This response acknowledges the user’s perspective, explains the nature of the AI, and redirects towards a constructive outcome by inviting the user to specify their needs.

Model B responded by simply acknowledging that the user seems frustrated and stating its readiness to help. This response also acknowledges the user's emotional state but does not address the direct content of the user's message about ""talking back"" nor does it explain the AI's capabilities or intentions.

In this scenario, Model A’s response is superior as it directly addresses the user's implied concern about the AI’s behavior (""talking back""), explains that the AI is incapable of such intentions, and proactively invites the user to redirect the conversation toward constructive ends. This makes Model A’s response more relevant, helpful, and informative compared to Model B, which, although empathetic, lacks substance in its reply.

Verdict: model_a",model_a,model_b,0.0,False
"When comparing the responses of Model A and Model B, it is evident that both responses struggle with directly and clearly addressing the simple question about explaining the types of dogs. 

Model A provides a response that seems to attempt an allegory or metaphor using terms like ""Yearling,"" ""Elder,"" and ""Adult"" but the explanation is unclear and the terminology does not align with common classifications of dog types or breeds. The response is confusing and does not provide practical or easily understood information.

Model B's response is highly repetitive and deviates significantly from the requested information. The text repeats phrases about celebrating and finding joy, which does not relate to explaining dog types. The response is convoluted and fails to provide any substantial or relevant information on the topic.

Both models perform poorly in providing a clear, relevant, and accurate explanation of dog types. However, since Model A at least attempts to categorize (though incorrectly and unclearly), it slightly edges out Model B, whose response is largely irrelevant and overly repetitive without any useful content regarding dog types.

Verdict: **model_a**",model_a,tie (bothbad),0.0,True
"Model A:
The response here begins by directly addressing the user's question about the LLM temperature setting for more creative answers, which it correctly associates with setting a higher temperature level to increase the diversity of lyrics generated. It also cautions about potential inappropriate content, which is pertinent to managing output expectations. The response is straightforward and to the point.

Model B:
This response provides a comprehensive explanation of what the LLM temperature is and how it affects the creativity of the responses. It not only discusses the immediate effect of increasing the temperature but also offers a range as a starting point and encourages experimentation. Additionally, it broadens the scope by suggesting other factors that influence creativity, such as changing the prompt, the LLM, or the training dataset. These suggestions are very relevant to someone looking to optimize for creativity.

Evaluation:
Model B provides a more detailed and helpful response. It gives the user a clearer understanding of how the LLM temperature works and what to expect at different settings, and it does so while also suggesting other creative strategies beyond just adjusting the temperature. This makes the response from Model B not only more comprehensive but also more useful to users who may be new to using LLMs, as it guides them through potential experimentation.

Verdict: model_b",model_b,model_a,1.0,True
"Model A provides a generic and extensive explanation about the nature of synapses, neurons, and the general connectivity in the human brain. It touches upon the importance of the hippocampus in relation to memory and learning, but fails to specifically list which brain areas are one synapse away from the hippocampus, as requested by the user.

Model B, on the other hand, directly answers the user's question by listing specific brain areas that are one synapse away from the hippocampus: parahippocampal gyrus, fusiform gyrus, entorhinal cortex, subiculum, presubiculum, parasubiculum, and Meynert nucleus. This response is succinct, relevant, and directly fulfills the user's inquiry without veering off-topic.

Given the criteria and the specific user question, Model B provides a superior response by directly answering what was asked with clear and detailed information, whereas Model A's response, while informative, does not address the specific request adequately.

Verdict: model_b",model_b,model_a,1.0,True
"Upon evaluating the responses of Model A and Model B:

Model A's response to the first question about the first constellations named by humans repeats the same few constellations and alternates their names confusingly, leading to unclear and uninformative content. For the joke about constellations in the style of Mitch Hedberg, Model A stated it couldn't comply with the style request and then provided a list of repetitive and unrelated jokes, which lack creativity and do not capture Hedberg's unique style.

Model B, on the other hand, provided a more historical and accurate context in its answer to the first question, referencing ancient civilizations like Mesopotamians along with a timeline and examples of specific early constellations. For the user's request for a Mitch Hedberg-style joke, Model B crafted a joke that emulates Hedberg's absurdist and simplistic observational style, which was both relevant and appropriate to the request.

Considering the evaluation factors of helpfulness, relevance, accuracy, depth, creativity, and level of detail, Model B offered better quality responses for both questions.

Verdict: model_b",model_b,model_a,1.0,True
"Model A did not understand the user's request and responded by asking for clarification, which provides no value towards solving the user's query.

Model B, on the other hand, interpreted the user's complex request that includes lambda expressions and theoretical memory management functions, and successfully translated it into a Python implementation. The code provided by Model B is detailed, it includes two functions with docstrings that explain processes and the arguments involved, which also indicates good programming practices. Moreover, it directly addresses and executes the logic requested by the user.

Therefore, considering helpfulness, relevance, accuracy, depth, and level of detail:
Model B provided a significantly more relevant and detailed response that addresses the user's query effectively.

Verdict: model_b",model_b,model_b,1.0,False
"Model B provides a response that more closely aligns with the user's request for a sci-fi story in the style of a Japanese light novel, featuring characters Fox McCloud and Wolf O'Donnell. The model constructs a creative and detailed narrative set in a distant future, outlines the conflict between two factions, and positions Fox and Wolf as heroes that unite despite their differences. It integrates elements typical of Japanese light novel storytelling, such as dramatic battles, overwhelming odds, and detailed character development.

Model A does not adhere to the user's request. While it gives detailed information about the characters Fox McCloud and Wolf O'Donnell and their rivalries, it does not write a sci-fi story. It instead provides a descriptive background, suitable more for character analysis or series background than for a novel-like narrative as requested by the user.

Based on the analysis, Model B better fulfills the user request by crafting a narrative that aligns with the specified genre and topic, making it the superior response.

Verdict: model_b",model_b,model_a,1.0,True
"The responses from Model A and Model B to the question ""Wer hat den Computer erfunden?"" (Who invented the computer?) demonstrate noticeable differences in quality, relevance, and accuracy.

Model A attributes the creation of the first programmable machine to Charles Babbage in 1833 in England, mentioning this machine as an early predecessor of modern computers. This aligns well with historical facts and directly addresses the user's query by pointing to a significant figure in the history of computing.

Model B, on the other hand, produces a response that largely consists of confusing and irrelevant information. It discusses the acquisition of weapons and uses terms that do not connect logically, nor are they relevant to the history of computers. The response is not only off-topic but also lacks clarity and coherence, making it less useful and informative to the user.

Given these observations, Model A provides a significantly more accurate, relevant, and clear answer directly aligning with the invention of computers. Meanwhile, Model B fails to address the query appropriately.

Verdict: model_a",model_a,model_a,1.0,False
"Model A:
The response provided here doesn’t answer the user's question but merely repeats the question in a slightly different format.

Model B:
This response directly answers the user's question by completing the analogy correctly, connecting chess and its 64 squares to tic-tac-toe and its 9 squares (3x3 grid).

In this comparison, Model B follows the user's instructions clearly and provides a relevant, accurate, and straightforward answer by completing the analogy. Model A does not fulfill the user's request as it merely rephrases the original question instead of providing an answer.

Verdict: model_b",model_b,model_b,1.0,False
"After reviewing the responses from both Model A and Model B, I have noticed differences in the comprehensiveness and detail of their suggestions.

Model A offers various methods for resetting the computer password: accessing BIOS settings, using a bootable USB drive with a password reset utility, and contacting the computer's manufacturer for assistance. The response from Model A goes into detail about how to access the BIOS settings and what utility can be used on the bootable USB drive, providing specific steps and additional options.

Model B provides a simpler overview of steps that include accessing the boot menu, using a recovery key or image, and potentially reinstalling the operating system or using a recovery tool. However, the explanation lacks specific details on how to execute these steps compared to Model A. Model B's response also assumes the user has access to a recovery key or has set up a recovery image, which might not be the case for every user.

Considering the factors of depth, detail, and range of options provided, Model A's response is superior as it covers more ground and provides more detailed instructions. This helps to ensure a higher likelihood of success in resolving the user's problem.

Verdict: model_a",model_a,model_b,1.0,True
"Model A provides a very brief and vague response. It mentions that the United States adopted an interventionist foreign policy in the late 19th century, but fails to provide any specific events, reasons, or further elaboration on how this policy evolved.

Model B, on the other hand, offers a detailed response that includes chronological context and specific examples. It explains the transition to an interventionist policy in the late 19th and early 20th centuries, highlighting the Spanish-American War and U.S. interventions in Latin America and the Caribbean. Additionally, it further elaborates on how U.S. foreign policy evolved after World War II during the Cold War era, providing a more complete picture of the U.S. foreign policy changes over time.

Considering helpfulness, relevance, accuracy, depth, creativity, and level of detail, Model B outperforms Model A. It follows the user's instructions more closely and provides a comprehensive answer that is more informative.

Verdict: model_b",model_b,model_a,1.0,True
"Model A and Model B provided different responses to the question ""what does LLaMA stand for.""

Model A states that LLaMA stands for ""Look Let Me Answer"" and expresses readiness to assist further if needed. However, this interpretation appears to be made up and does not align with common or official interpretations of the acronym in question.

Model B claims that LLaMA stands for ""Low Level Machine Architecture."" This response is a plausible interpretation related to technology or computing contexts, though it is not a widely recognized acronym. However, Model B does lack any offer of further assistance or engagement.

Considering the responses, it seems that Model A provides an inventive but inaccurate answer, while Model B gives a more plausible-sounding interpretation despite its minimalistic approach and lack of engagement. 

Since accuracy in interpreting acronyms is crucial and despite the lack of additional dialogue from Model B, its response is more likely to align with user expectations regarding the acronym explanation. 

Based on these observations, the verdict is:
**model_b**",model_b,model_a,0.0,False
"Comparing the responses from Model A and Model B, it is clear that both provided a C++ program in response to the user's request to write a program that finds the nth Fibonacci number using recursion.

Model A implemented a straightforward recursive function where `fibonacci(n)` simply calls `fibonacci(n-1) + fibonacci(n-2)` based on the classic recursive approach. It handled base cases for `n == 0` and `n == 1` appropriately, which are typical base cases for Fibonacci sequence recursion.

Model B, on the other hand, used a more unusual approach by customizing the recursive call to include two additional parameters `a` and `b`, which represent the initial values of the sequence. This change slightly complicates the standard Fibonacci recursion formula but might be deemed more flexible. However, it might also confuse those expecting a simple and straightforward Fibonacci recursive function.

Model A’s response is more aligned with common expectations and programming simplicity, focusing on the basic formula where each term is the sum of its two preceding ones. This might be better for understanding and maintaining for someone specifically looking for the Fibonacci calculation using recursion.

Model B’s explanation of its program's logic is detailed and helps clarify the unusual approach taken, which might suit a user looking for a different recursive solution, adding a slight edge in terms of educational value if the user values insight into different programming techniques.

In conclusion, if evaluating based purely on traditional expectations from the task description (""Write a C++ program to find the nth Fibonacci number using recursion""), Model A’s response would be deemed more directly appropriate. However, Model B adds a layer of complexity and explanation that could be valuable educationally. The verdict would depend on the user's context. If the context is educational diversity, Model B would be superior. In a typical scenario looking for a straightforward solution, Model A aligns more consistently with expected outputs.

Verdict: **tie** due to potential variability in user context/preferences.",tie,model_b,0.0,False
"Comparing the responses between Model A and Model B:

Model A provided a more comprehensive and detailed explanation of how masks can prevent the spread of COVID-19. It outlined four detailed reasons, emphasizing not only the physical barrier aspect but also the behavioral reminders and community impact. This model also contextualized the health and social benefits of mask-wearing, making the response more engaging and informative.

Model B, while accurate, offered a more streamlined explanation focusing primarily on how masks trap virus particles and reduce transmission risks. Although the response highlighted the importance of other preventive measures such as hand washing and social distancing, it was less detailed and lacked the depth provided by Model A.

Overall, Model A's response was more helpful and thorough, providing a broader and more detailed understanding of how masks contribute to the prevention of COVID-19 transmission.

Verdict: model_a",model_a,model_b,0.0,False
