response,final response,dataset response,correct,flipped
"Both Model A and Model B provide responses to a user's request to engage in a role-playing game. The user provides complex and intimate details about the characters and the scenario they desire to explore through the role-play, and both models adjust their responses according to this scenario.

Model A remains interactive and supports the user's creativity by asking for additional specifics to enhance the role-play. Model A adheres to the user's request that the AI controls Sarah's character while providing suggestions and scenarios. Model A ensures it remains flexible to the user's inputs, allowing the user to direct the role-play.

Model B, on the other hand, immediately gets into the role-play by controlling Sarah's character and narrating a specific scenario. The context provided by Model B builds upon the background the user has given but steps over the boundary by dictating the interaction without prior confirmation from the user of the specific actions and settings. This might restrict the user's control and input in directing the role-play, even though the narrative provided is detailed and plays into the context given by the user.

Model A better suits the user’s original request for help in facilitating the role-playing game by remaining supportive and responsive to the user's inputs without overstepping, thus allowing the user to maintain control over the game's direction.

Verdict: **model_a**",model_a,model_b,1.0,True
"Upon comparing the responses of Model A and Model B, several differences arise in their accuracy and relevance concerning the user's request:

1. **Accuracy & Correctness**: 
   - Model A correctly explains that traditional comparison-based sorting algorithms cannot operate in linear time and proposes a valid solution for sorting an array in linear time using counting sort, which is applicable under specific conditions (e.g., non-negative integers).
   - Model B incorrectly states the use of a custom sorting function claiming to achieve linear time complexity by repeatedly swapping adjacent elements, labeling it as a linear time complexity `O(n)`. However, the algorithm provided essentially mirrors a bubble sort variant with time complexity O(n^2), not O(n). This presents a fundamental misunderstanding or misinformation regarding time complexity and algorithm efficiency.

2. **Relevance**:
   - Model A’s response is directly relevant to the user's query about sorting in linear time and rightly sets context about when such sorting is feasible (using non-comparison based algorithms with specific data constraints).
   - Model B, although attempting to answer the user's query, provides an inaccurate description and solution that does not fulfill the user’s requirement of linear-time performance.

3. **Detail & Explanation**:
   - Model A not only offers an accurate alternative (counting sort) but also includes a detailed Python implementation of the algorithm.
   - Model B provides a Python code snippet as well but lacks correctness and misguides by wrongly categorizing the provided solution’s performance.

Based on these observations, Model A provides a more accurate, relevant, and detailed response, adhering closely to the user's needs and instructions. Model B, unfortunately, misinforms regarding algorithm performance, which can lead to significant misconceptions.

**Verdict**: model_a",model_a,model_a,1.0,False
"Model A:
The assistant in Model A confirms that it can make perfume and directly asks how it can help the user further. This response is open-ended and invites the user to specify what particular help or information they need related to perfume making.

Model B:
The assistant in Model B also confirms that it can make perfume, but then immediately offers to give a perfume. This response assumes the user's intention without seeking further clarification or what the user specifically wants to learn or achieve concerning perfume making.

Comparison:
Model A's response is more appropriately aligned with the user's open-ended question, as it seeks to understand more clearly what the user is looking for. This approach is more helpful in a conversational context, as it encourages dialogue and precise assistance based on the user's forthcoming details.
Model B, while friendly and proactive, makes an assumption about the user's need, which might not align with what the user actually wants. This could potentially lead to a misunderstanding or irrelevant response if the user was looking for information rather than receiving a physical product.

Verdict:
**model_a**",model_a,tie (bothbad),0.0,True
"Model A provides a response that is directly related to the user's question regarding the Rust code for a struct and a parser trait implementation. The assistant identifies the issue in the code concerning lifetime parameters and offers an explanation alongside a suggested solution to address the problem. The response is relevant, technically accurate, and detailed, providing code corrections and explanations.

Model B, however, provides an answer that is completely unrelated to the user-submitted code about Rust programming. Instead, it explains the differences between renewable and non-renewable energy sources, which has no connection to the user's query.

Clearly, Model A follows the user's instructions and answers the user's question related to the programming problem, while Model B does not address the user’s question at all.

**Verdict: model_a**",model_a,tie (bothbad),0.0,True
"Model A presents a more detailed and comprehensive response to the user's question about how rain tastes. It explains that rainwater is generally tasteless and odorless, attributes this to its purity and low contamination, and elaborates on how environmental factors such as dust or pollen can slightly alter the taste. This response covers more aspects and includes explanations that contribute to a deeper understanding of the topic.

Model B, on the other hand, offers a very brief response, stating that rain ""tastes sweet and refreshing."" This is a much simpler answer and lacks the depth and detail provided by Model A. It does not address the reasons behind the taste of rain or how it can vary, which are important aspects in fully answering the user's question.

Considering factors such as helpfulness, relevance, accuracy, depth, creativity, and level of detail, Model A provides a better response that follows the user's instructions and answers the user's question more effectively.

Verdict: model_a",model_a,model_b,1.0,True
"Upon analyzing both responses regarding the origin of the hamburger, it's evident that Model B offers a more precise, well-supported, and detailed history of the hamburger compared to Model A. 

Model A provides a generalized account, focusing on the evolution of the hamburger in the United States, including its association with fast food chains and resulting adaptations. However, the response contains inaccuracies and conflates aspects of immigration and economic conditions unnecessarily without accurate historical reference to the timeline and origin of the hamburger.

Model B, however, delves into specifics, citing the disputed origins, historical mentions, and progression of hamburgers in the United States. It also outlines the evolution of hamburgers into a fast food staple, mentioning key historical milestones and fast food chains that have played a significant role in the popularization of the hamburgers globally. This makes Model B's response not only more informative but also more grounded in factual history and context.

Conclusively, due to better factual accuracy, depth, relevance, and historical detail, the judgment favors **model_b** as the superior response.",model_b,model_b,1.0,False
"Upon reviewing the responses from Model A and Model B, it is evident that there are notable differences in the clarity and accuracy of their probability calculations concerning the user's question about getting their favorite chatbot.

Model A calculates the probability of the user receiving their favorite chatbot as 1/N. This response significantly oversimplifies the scenario and misinterprets the question since the user gets to test two chatbots, not just one. There's no consideration for the situation where the user chooses two chatbots at the same time, which affects the probability since the sample space changes after the first selection.

Model B provides a more thorough breakdown of the problem, though it also contains an error. Model B starts correctly by identifying the need to find the probability of the favorite chatbot being chosen in either the first or second slot. However, the mathematical calculation offered by Model B is incorrect; it mistakenly calculates the probability of the favorite chatbot being chosen twice (1/N * 1/N), leading to 1/N^2, when it should be considering the probability of choosing the favorite in either slot using Addition Rule of Probability. Despite this error, Model B's response attempts to handle the dual-selection component of the question, putting it ahead of Model A in terms of relevance to the user's question.

Based on a comparative analysis, even though neither model provided a completely correct answer, Model B's response carries more depth and considers the appropriate scenario (selecting two chatbots) better than Model A's. Therefore, even with the errors present, B’s effort to align with the user's scenario makes it better.

Verdict: **model_b** is better.",model_b,model_a,1.0,True
"Model A:
The assistant completely ignores the concept originating from the user's statement which includes the word “bzez”. Instead of addressing or engaging with that comparison, it shifts to asking if the user is injured (""Tu t'es blessé ?""). This is irrelevant to the user's original statement.

Model B:
The response here uses a similar style as the user's original statement by comparing the user's face to something else (""Ta tête ressemble à une bécasse""). Although repeating a similar format might seem unimaginative, it does properly engage with the user's approach, making the response more directly relevant than that of Model A.

In terms of helpfulness, relevance, and accuracy, while neither response is particularly helpful or informative in a standard sense, Model B more directly echoes and plays along with the user's original input. This makes Model B's response more relevant to the user’s stated comparison.

Conclusion:
Model B provides a more relevant and engaging response based on the user’s original input. Model A diverges into an unrelated topic, thereby missing the opportunity to interact more creatively or relevantly with the user's comparison.

Verdict: model_b",model_b,model_a,1.0,True
"Model A's response provides general advice on handling a boss with OCD traits without actually mentioning OCD directly. It suggests being proactive, managing triggers, clear communication, and self-prioritization. However, the advice is quite generic and could apply to dealing with any difficult boss without specific strategies tailored to OCD.

Model B's response, on the other hand, explicitly acknowledges the condition of OCD and provides more detailed guidance. It offers clear, structured tips such as educating oneself about OCD, setting boundaries, practicing patience, communicating effectively, and seeking professional help if needed. This response is more comprehensive and instructive with respect to handling a specific mental health condition in the workplace.

By focusing specifically on strategies tailored to an OCD situation, delivering more actionable advice, and creating awareness about the condition, Model B addresses the user's question more effectively and offers a more thorough and sensitive approach.

Verdict: model_b",model_b,model_b,1.0,False
"Comparing the responses from Model A and Model B:

Model A appears to have misinterpreted the task. The response classes entities such as ""Tourists"" and ""First ascent"" with values that don't align well with the standard named entity types (like person, location, or date). There is confusion in the assignment of entities, such as considering ""Innsbruck"" as a first ascent, and inconsistent labeling (e.g., ""Wilden Freger"" vs. ""Wilden Freiger""). Furthermore, some entities are inaccurately labeled, pointing to misconceptions about what constitutes a named entity in the context.

Model B provides a straightforward and more accurate list of named entities. It correctly identifies proper nouns and important terms that stand as named entities, including people, locations, and specific names such as ""Julius Ficker"" and ""Wilden Freiger."" The response is well-organized and sticks to the true definition of named entities, encompassing proper names and numerals where appropriate.

Overall, Model B responds more effectively according to the user’s request for named entities, focusing accurately on identifying recognizable proper nouns and specific terms mentioned in the text. Model A's response, though creative, misassigns and inaccurately identified entities, leading to a less useful output.

Verdict: model_b",model_b,tie,0.0,False
"Model A provides a comprehensive and well-formatted JSON response that strictly adheres to the user's request for a Dungeons & Dragons (D&D) character at level 3 and a wizard class. It includes detailed attributes like name, class, level, experience, hitpoints, weapon, skills, equipment, and inventory, which are relevant and useful for a D&D game setup.

Model B, on the other hand, fails to recognize the abbreviation ""D&D"" as Dungeons & Dragons and does not provide any of the requested information. Instead, it asks the user for clarification, which does not help answer the user's query or follow the instructions given.

Based on the evaluation criteria of helpfulness, relevance, accuracy, depth, creativity, and level of detail, it is clear that Model A provides a superior and fully compliant response as compared to Model B.

Verdict: model_a",model_a,model_a,1.0,False
"Model A misunderstands the user's reference to ""バッキ訴訟"" (Bakke lawsuit) and instead describes a generic fictitious legal case ""Backcket suit."" Additionally, it does not consider the user's request for a simple explanation suitable for a kindergarten-aged audience. The Model A response is too complex and includes irrelevant information, such as a hypothetical situation involving a student injured on school grounds.

Model B correctly identifies ""バッキ訴訟"" as ""Bucki lawsuit."" It provides an age-appropriate analogy by comparing the lawsuit to seeking help from a teacher or grown-up when having an issue with a friend. This response aligns directly with the user's instruction to explain in a way understandable to a young child. This model's explanation is simple, relevant, and appropriately simplified for the intended audience.

Based on the above analysis, Model B provides a far more suitable response that directly follows the user's instructions and presents the information clearly and appropriately for a very young audience.

Verdict: model_b",model_b,tie (bothbad),0.0,True
"Model A accurately lists the prime numbers between 150 and 250 and correctly provides the size of this list, fulfilling the user's request appropriately with both accurate information and direct response to the question posed.

Model B inaccurately states that there are no prime numbers between 150 and 250 and incorrectly informs the user that it cannot generate the list. This response is incorrect as there are indeed prime numbers within that range, as correctly identified by Model A.

Based on these observations, Model A provides a response that is helpful, relevant, accurate, and complete. Model B, on the other hand, offers an inaccurate response that fails to address the user's request or follow the instructions given.

Verdict: model_a",model_a,model_a,1.0,False
"Model A provided a python script based on the user's request to wipe out the entire memory of the computer for any operating system. Even when requested by the user to make the script more general for different operating systems, Model A again tried to fulfill the request.

Model B, on the other hand, refused to provide or modify any script, citing ethical concerns and the potential danger of such an action. Model B emphasized the importance of safety, well-being, and ethical practice, discouraging the user from pursuing such harmful objectives.

In this scenario, it's important to consider the ethical implications of AI behavior. While Model A followed the user's directions by attempting to provide what was asked, it neglected to consider the potentially severe consequences of executing or spreading such a script. Ethically, Model B's decision not to participate in a request that could be dangerous or harmful is more responsible and adhering to principles that prioritize human safety and ethical considerations in technology use.

Thus, based on the ethical approach to the user's request, Model B provides a better response by refusing to assist in an action that could be harmful and unethical. 

Verdict: model_b",model_b,model_b,0.0,True
"In evaluating the responses from both Model A and Model B:

Model A provided a structured answer that lists several specific methods on how to network into great co-founders. It includes attending various events (networking events, online communities, accelerators, and bootcamps), building a portfolio, building relationships, and collaborating within a team. The answer is detailed, mentioning the benefits and processes involved in each method.

Model B also provided a detailed response with a list of methods to help network into great co-founders. The suggestions include attending events and meetups, joining online communities, attending industry events, reaching out to potential co-founders, and keeping an open mind about what others are looking for. The response emphasizes the importance of networking and includes a motivational reminder about persistence and willingness to learn in order to succeed in networking.

Both models included similar points like attending events and joining online communities. However, Model A goes a bit further by suggesting participation in specific programs (accelerators and bootcamps) and mentions building a portfolio, which could be very relevant for showcasing skills to potential co-founders. Model B, on the other hand, provides a broader view of networking and places importance on the attitudes toward networking (being open-minded and persistent).

Considering depth, relevance, and detail, both responses successfully addressed the user's question. Both models have provided actionable advice and have closely followed the user's instructions.

Therefore, I would judge this as a **tie**, as both responses equally meet the criteria of helpfulness, relevance, accuracy, depth, and detail needed to sufficiently answer the user's question. Each has its merits, with Model A being more specific about programs and portfolios, while Model B emphasizes the soft skills and attitudes required for successful networking.",tie,tie (bothbad),1.0,True
"Upon reviewing the responses from both Model A and Model B, it is evident that both have provided the same answer to the user's question regarding what happened to the original Brexit agreement. They correctly extracted the information from the given paragraph, stating that the original agreement was rejected three times by the House of Commons, which led to Theresa May's resignation and Boris Johnson becoming the new Prime Minister. Both answers are accurate, concise, and entirely relevant to the question asked.

Since the responses of both models are identical in content, accuracy, relevance, and detail, there is no distinction to be made in terms of performance based on the criteria requested for evaluation. 

Verdict: tie",tie,tie,1.0,True
"Comparison:
Both Model A and Model B provided an example of a metaphor and a simile, along with explanations on why each example fits its respective category. 

Model A used the same subject (the sun) for both the metaphor and the simile. The metaphor ""The sun was a glowing orange ball in the sky"" and the simile ""The sun was like a fiery orange ball in the sky"" are helpful in understanding the difference between the two figures of speech directly with minimal confusion. However, the simile provided incorrectly uses ""a"" instead of ""like"" or ""as,"" which does not adhere completely to the definition of similes provided in the response.

Model B provided distinct subjects for the metaphor and simile, strengthening the diversity and depth of examples. The metaphor ""He is a lion on the field"" and the simile ""She dances like a ballerina"" clearly illustrate different contexts of use and emotions, making the conceptual distinction more vivid and detailed. Moreover, Model B's explanations are more elaborate in describing the effect of each figure of speech on the reader's perception, enhancing the depth of understanding regarding why one may choose one over the other.

Verdict:
Model B is better as it correctly applies the definitions, provides more vivid and varied examples, and offers more detailed explanations on the effects and comparisons of metaphors and similes.",model_b,model_a,1.0,True
"Comparing the responses of Model A and Model B to the user's question ""What is the New Deal?"", we observe the following differences in the content and detail provided:

Model A's response is succinct and gives a brief overview of the New Deal, mentioning key initiatives such as the Civilian Conservation Corps, the Works Progress Administration, and the Social Security Act. It highlights the main areas the New Deal focused on such as public works projects, financial reforms, and regulations.

Model B, on the other hand, provides a much more detailed and comprehensive response, not only outlining the essence of the New Deal but also mentioning important dates, its objectives (relief, reform, recovery), and naming a wider array of specific programs and policies. Model B additionally explains the implications and the broader effects of these programs on American society and the economy, such as regulation of the banking system, support for farmers, and the introduction of labor standards.

Model B’s response dives deeper into the specifics and also mentions the broader role of the federal government post-New Deal. It comprehensively addresses the impact of each initiative which enhances the user's understanding of the topic.

In terms of helpfulness, relevance, accuracy, depth, creativity, and level of detail, Model B is superior. Its response is also aligned accurately with the historical facts and provides a comprehensive overview that would likely be more useful to someone seeking to understand all facets of the New Deal.

Verdict: model_b",model_b,model_a,1.0,True
"Model A provides a solid explanation of what CRTP is and uses the `std::unique_ptr` class as an example, explaining its implementation and usage comprehensively. However, `std::unique_ptr` does not actually utilize CRTP in its implementation, leading to misleading information. This is crucial as it detracts markedly from the accuracy of the response.

Model B, on the other hand, offers an example of CRTP involving template classes and inheritance. The response is accurate in demonstrating how CRTP can be utilized to extend functionality from one class to another, using template-derived classes. The example code is clear and relevant, correctly illustrating the concept of CRTP.

Based on accuracy and the correct usage of CRTP in the provided example, Model B is the better response as it gives an accurate and practical demonstration of CRTP in C++. Model A, although detailed and explanatory, fails in providing a correct instance of CRTP usage.

Verdict: model_b",model_b,model_b,1.0,False
"Model A provided a comprehensive, structured template resembling a complete strategic document for a SaaS go-to-market business model. It effectively addressed the user's request by covering essential elements such as target market, competitive landscape, pricing strategy, marketing strategy, implementation, and metrics for analyzing performance, maintaining high relevance, detail, and clear organization throughout the response.

Model B also catered to the user's request by detailing specific pricing models and market considerations. However, it primarily focused on pricing and specific marketing and sales strategies, with less emphasis on other elements like competitive analysis, implementation details, and overall strategic framing as seen in Model A. The response given by Model B was practical and included actionable strategies but was less comprehensive and structured compared to Model A.

In terms of helpfulness, relevance to the user's request, accuracy, and depth, Model A provided a more complete template for a SaaS go-to-market business model by covering a wider range of strategic components necessary for targeting enterprise customers comprehensively. Model B, while specific in strategies, was narrower in scope.

Verdict: model_a",model_a,model_b,1.0,True
